[
  {
    "id": "anthropic-claude-sonnet-4-6",
    "providerId": "anthropic",
    "displayName": "Claude Sonnet 4.6",
    "apiModelId": "claude-sonnet-4-6",
    "family": "Claude Sonnet",
    "tier": "frontier",
    "status": "active",
    "releaseStage": "active",
    "recordStatus": "reviewed",
    "description": "Balanced high-capability model for coding, reasoning, and general agent work.",
    "lastVerifiedAt": "2026-04-28",
    "sourceUrls": ["https://docs.anthropic.com/"],
    "aliases": ["sonnet"]
  },
  {
    "id": "openai-gpt-5-4",
    "providerId": "openai",
    "displayName": "GPT-5.4",
    "apiModelId": "gpt-5.4",
    "family": "GPT-5",
    "tier": "frontier",
    "status": "active",
    "releaseStage": "active",
    "recordStatus": "reviewed",
    "description": "High-capability general model for coding, reasoning, and orchestration tasks.",
    "lastVerifiedAt": "2026-04-28",
    "sourceUrls": ["https://platform.openai.com/docs/overview"],
    "aliases": ["GPT"]
  },
  {
    "id": "google-gemini-2-5-pro",
    "providerId": "google",
    "displayName": "Gemini 2.5 Pro",
    "apiModelId": "gemini-2.5-pro",
    "family": "Gemini 2.5",
    "tier": "frontier",
    "status": "active",
    "releaseStage": "active",
    "recordStatus": "reviewed",
    "description": "High-end Gemini model for advanced reasoning and multimodal tasks.",
    "lastVerifiedAt": "2026-04-28",
    "sourceUrls": ["https://ai.google.dev/gemini-api/docs"],
    "aliases": ["gemini-pro"]
  },
  {
    "id": "groq-llama-3-3-70b",
    "providerId": "groq",
    "displayName": "Llama 3.3 70B (Groq)",
    "apiModelId": "llama-3.3-70b-versatile",
    "family": "Llama 3.3",
    "tier": "fast",
    "status": "active",
    "releaseStage": "active",
    "recordStatus": "reviewed",
    "description": "Fast hosted open-weight route on Groq infrastructure.",
    "lastVerifiedAt": "2026-04-28",
    "sourceUrls": ["https://console.groq.com/docs/overview"],
    "aliases": []
  },
  {
    "id": "openrouter-claude-sonnet-4-6",
    "providerId": "openrouter",
    "displayName": "Claude Sonnet 4.6 via OpenRouter",
    "apiModelId": "anthropic/claude-sonnet-4.6",
    "family": "Claude Sonnet",
    "tier": "aggregated",
    "status": "active",
    "releaseStage": "active",
    "recordStatus": "reviewed",
    "description": "Aggregated access route for Claude Sonnet through OpenRouter.",
    "lastVerifiedAt": "2026-04-28",
    "sourceUrls": ["https://openrouter.ai/docs/overview/introduction"],
    "aliases": []
  }
]
